{
  "event_id": "e1",
  "ts": "2026-09-29T12:49:30Z",
  "agent": "agent-a",
  "env": "prod",
  "action": "tool.call",
  "risk": "low",
  "decision": "allowed",
  "prev_hash": "abc123",
  "hash": "0000000000000000000000000000000000000000000000000000000000000000",
  "payload": {
    "中文": "风机检修",
    "emoji": "🌊"
  }
}
